{
  "$schema": "https://json-schema.org/draft/2020-12/schema",
  "$id": "https://aqarion.dev/schemas/evidence-object-v0.1.json",
  "title": "AQARION Evidence Object",
  "description": "Canonical evidence record for claims, skills, and computational certificates. Status codes deliberately prevent silent promotion of computation into proof.",
  "type": "object",
  "additionalProperties": false,

  "required": [
    "claim_id",
    "statement",
    "status",
    "scope",
    "inputs",
    "outputs",
    "verification",
    "artifacts",
    "created_at"
  ],

  "properties": {
    "claim_id": {
      "type": "string",
      "pattern": "^AQ-(CLAIM|THM|SKILL|OBJ|CERT)-[A-Z0-9-]+$"
    },

    "statement": {
      "type": "string",
      "minLength": 1
    },

    "status": {
      "type": "string",
      "enum": ["D", "V", "P", "PV", "C", "R", "F", "Q"]
    },

    "scope": {
      "type": "object",
      "additionalProperties": false,

      "required": [
        "system_class",
        "operator_convention",
        "assumptions"
      ],

      "properties": {
        "system_class": {
          "type": "string",
          "minLength": 1
        },

        "operator_convention": {
          "type": "string",
          "const": "K_x,T(x)=1"
        },

        "observation_contract_hash": {
          "type": "string",
          "pattern": "^[a-f0-9]{64}$"
        },

        "assumptions": {
          "type": "array",
          "items": {
            "type": "string"
          },
          "minItems": 1
        },

        "n": {
          "type": "integer",
          "minimum": 1
        }
      }
    },

    "inputs": {
      "type": "object",
      "additionalProperties": false,

      "required": [
        "canonical_sha256"
      ],

      "properties": {
        "canonical_sha256": {
          "type": "string",
          "pattern": "^[a-f0-9]{64}$"
        },

        "serialization_version": {
          "type": "string",
          "default": "1.0"
        },

        "description": {
          "type": "string"
        }
      }
    },

    "outputs": {
      "type": "object",
      "additionalProperties": false,

      "required": [
        "canonical_sha256",
        "result_path"
      ],

      "properties": {
        "canonical_sha256": {
          "type": "string",
          "pattern": "^[a-f0-9]{64}$"
        },

        "result_path": {
          "type": "string"
        },

        "summary": {
          "type": "object"
        }
      }
    },

    "verification": {
      "type": "object",
      "additionalProperties": false,

      "required": [
        "exact_arithmetic",
        "orientation_lock",
        "lean"
      ],

      "properties": {
        "exact_arithmetic": {
          "type": "boolean"
        },

        "independent_reexecution": {
          "type": "boolean"
        },

        "orientation_lock": {
          "type": "boolean",
          "const": true
        },

        "mutation_tests": {
          "type": "object",
          "additionalProperties": false,

          "required": [
            "total",
            "passed"
          ],

          "properties": {
            "total": {
              "type": "integer",
              "minimum": 0
            },

            "passed": {
              "type": "integer",
              "minimum": 0
            }
          }
        },

        "lean": {
          "type": "object",
          "additionalProperties": false,

          "required": [
            "status"
          ],

          "properties": {
            "status": {
              "type": "string",
              "enum": [
                "not-applicable",
                "pending",
                "partial",
                "pass",
                "fail"
              ]
            },

            "source": {
              "type": "string"
            },

            "sorry_count": {
              "type": "integer",
              "minimum": 0
            },

            "axioms_used": {
              "type": "array",
              "items": {
                "type": "string"
              }
            }
          }
        }
      }
    },

    "artifacts": {
      "type": "array",
      "minItems": 1,

      "items": {
        "type": "object",
        "additionalProperties": false,

        "required": [
          "role",
          "path",
          "sha256"
        ],

        "properties": {
          "role": {
            "type": "string",
            "enum": [
              "input",
              "output",
              "verifier",
              "proof",
              "test-fixture",
              "reproduction-script",
              "observation-contract",
              "ro-crate",
              "adversarial-fixture"
            ]
          },

          "path": {
            "type": "string"
          },

          "sha256": {
            "type": "string",
            "pattern": "^[a-f0-9]{64}$"
          },

          "media_type": {
            "type": "string"
          }
        }
      }
    },

    "dependencies": {
      "type": "array",
      "items": {
        "type": "string",
        "pattern": "^AQ-(DEF|THM|CLAIM|SKILL|OBJ|CERT)-[A-Z0-9-]+$"
      }
    },

    "rejection_tests": {
      "type": "array",

      "items": {
        "type": "object",
        "additionalProperties": false,

        "required": [
          "name",
          "result"
        ],

        "properties": {
          "name": {
            "type": "string"
          },

          "result": {
            "type": "string",
            "enum": [
              "PASS",
              "FAIL",
              "EXPECTED_FAIL"
            ]
          },

          "description": {
            "type": "string"
          }
        }
      }
    },

    "created_at": {
      "type": "string",
      "format": "date-time"
    },

    "producer": {
      "type": "object",
      "additionalProperties": false,

      "properties": {
        "name": {
          "type": "string"
        },

        "version": {
          "type": "string"
        },

        "commit": {
          "type": "string"
        }
      }
    }
  }
}
